Seedlip Distilled Non-Alcoholic Spirits Grove 42 Citrus 700ml, 7
Heineken 0.0 Alcohol Free Lager Beer Bottles 4 x 330ml, 0
Beck's Blue Alcohol-Free Beer Bottles 6x275ml, 17
Kopparberg Alcohol Free Pear Cider 500ml, 32
Kopparberg Alcohol Free Mixed Fruit Cider 500ml, 23
Green's Supreme Golden Ale (Gluten Free) 330ml, 31
Beavertown Neck Oil Session Ipa 330ml, 47
Beavertown Neck Oil 4x330ml, 14
Bud Light Lager Beer bottles 4x300ml, 91
Birra Moretti Lager Beer Bottles 4 x 330ml, 13
BrewDog Punk India Pale Ale (IPA) 330ml, 42
Birra Moretti Lager Beer Bottle 660ml, 146
Bishop's Finger Ale 500ml, 60
Peroni Nastro Azzurro Lager 4x330ml, 16
Corona Extra Premium Lager Beer bottles 4x330ml, 17
Stella Artois Premium Lager Beer Cans 4x568ml, 73
Old Speckled Hen Ale 4x500ml, 8
Kronenbourg 1664 Lager Beer Cans 4 x 440ml, 19
San Miguel Especial Premium Lager Bottle 660ml, 20
Guinness Original Stout 500ml, 24
Fuller's London Pride Ale 4x500ml, 7
BrewDog Punk India Pale Ale (IPA) 4x330ml, 19
BrewDog Dead Pony Club Beer 330ml, 14
Desperados Tequila Lager Beer Bottles 3 x 330ml, 26
Crabbies Original Alcoholic Ginger Beer 4x330ml, 0
Leffe Blond Abbey Beer Bottles 4x330ml, 17
Duvel Belgian Golden Ale 330ml, 23
John Smith's Extra Smooth Ale Cans 4 x 440ml, 7
Heineken Premium Lager Beer Bottle 650ml, 52
Hoegaarden Rosée Belgian Wheat Beer Bottle 750ml, 29
Cobra Premium Beer 620ml, 10
Aspall Premier Cru Dry Cyder 500ml, 19
Kopparberg Mixed Fruit Cider 500ml, 32
Aspall Draught Cyder 500ml, 17
Strongbow Original Cider Cans 4 x 440ml, 19
Thatchers Haze Cloudy Cider 4x440ml, 17
Gordon's Gin & Slimline Tonic 250ml, 41
Gordon's Gin & Tonic 250ml, 23
Pimm's & Lemonade 250ml, 31
Malibu Coconut Rum & Pineapple Mixed Drink 250ml, 144
Vodka Lime & Soda 250ml Not Found
Jack Daniel's & Cola 330ml, 60
Gin & Rose Lemonade 250ml Not Found
Gordon's Dry Gin 1L, 30
Bombay Sapphire Gin 1L, 46
The Famous Grouse Blended Whisky 1L, 34
Grant's Triple Wood Blended Scotch Whisky 1L, 46
Jack Daniel's Whiskey 1L, 23
Russian Standard Vodka 1L, 14
Smirnoff Red Label Vodka 1L, 47
Absolut Vodka 1L, 9
Red Leg Spiced Rum 70cl, 9
Mount Gay 1703 Eclipse Rum 70cl, 21
Courvoisier Cognac VS 70cl, 15
Jose Cuervo Especial Tequilla 50cl, 15
Sierra Reposado Tequila 50cl, 12
Sierra Silver Tequila 50cl, 5
Campo Viejo Rioja Tempranillo 75cl, 66
La Patrie Cahors Malbec 75cl, 20
Bouchard Aine Et Fils Pinot Noir 75cl, 23
Wolf Blass Red Label Shiraz Cabernet 75cl, 19
Campo Viejo Rioja Reserva 75cl, 16
Graffigna Reserve Malbec 75cl, 47
Reserve de Bonpas Cotes du Rhone 75cl, 46
Châteauneuf Du Pape Les Courlandes 75cl, 22
Georges Duboeuf Brouilly 75cl, 12
Côtes De Provence Rosé Not Found
Oyster Bay Rosé 75cl, 10
Touraine Rose Not Found
Cava Brut 75cl Not Found
Rosé Cava 75cl Not Found
Bucks Fizz 75cl Not Found
Moët & Chandon Impérial Brut Non Vintage Champagne 75cl, 81
Lanson Black Label Brut Not Found
Veuve Clicquot Yellow Label Brut Non Vintage Champagne 75cl, 94
Etienne Dumont Brut Champagne Not Found
Conegliano Prosecco Not Found
Canti Prosecco 75cl, 109
Conegliano Prosecco Not Found
Pinot Grigio Not Found
Vinedos Barrihuelo Rioja Crianza Not Found
McGuigan Estate Chardonnay 75cl, 60
Pinot Grigio Not Found
Oyster Bay Sauvignon Blanc 75cl, 112
Languedoc White Wine Not Found
Casillero Del Diablo Sauvignon Blanc 75cl, 54
Petit Chablis Not Found
Gallo Family Vineyards Pinot Grigio 75cl, 16
Campo Viejo Rioja Viura-Tempranillo Blanco White Wine 75cl, 37
Ella's Kitchen Strawberries & Apples Pouch 120g 4 Month+, 22
Ella's Kitchen Pears Pears Pears Pouch 70g 4 Month+, 23
Ella's Kitchen Prunes Prunes Prunes Pouch 70g 4 Month+, 15
Ella's Kitchen Apples & Bananas Pouch 120g 4 Month+, 12
Sudocrem Antiseptic Healing Cream 175g, 19
Metanium Nappy Rash Ointment 30g, 17
SMA PRO First Infant Milk From Birth 800g, 12
Cow & Gate 2 Follow On Baby Milk Formula Multipack 4x200ml, 4
Pampers New Baby - Size 0 Carry Pack 24 Nappies, 20
Pampers New Baby - Size 1 Carry Pack 22 Nappies, 10
Pampers Newborn Size 2 Carry Pack 31 Nappies, 8
Pampers Baby Dry Size 3 Essential Pack 50 Nappies, 2
Pampers Baby Dry Size 4 Essential Pack 44 Nappies, 3
Pampers Baby Dry Size 5 Essential Pack 39 Nappies, 9
Pampers Baby Dry Size 6 Essential Pack 33 Nappies, 8
Pampers Baby-Dry Nappy Pants Size 6 15kg+ Essential Pack x28, 9
Pampers Baby-Dry Nappy Pants Size 7 6-11kg Essential Pack x25, 12
Burt's Bees Baby Bee No Tear Shampoo, 13
Johnson's Baby Gold Shampoo 300ml, 8
Pampers Sensitive Baby Wipes 52 Pack, 80
Aveeno Baby Daily Care Baby Hair & Body Wash 300ml, 18
New York Bakery Co. Bagels Not Found
New York Bakery Co. Bagels Not Found
Half Ciabatta Not Found
Hovis Soft Medium Sliced White Bread 800g, 17
Kingsmill Medium Sliced 50/50 Bread 800g, 58
Warburtons Thick Sliced Seeded Bread 800g, 19
Warburtons Toastie Thick Sliced White Bread 800g, 58
Jus-Rol Pain Au Chocolat Dough x6 275g, 14
Weetabix Cereal x24, 54
Weetabix Crispy Minis Chocolate Chip 600g, 79
Nestle Cheerios Cereal 600g, 29
